use_scenario,current_support,permitted_conclusion,missing_evidence,claim_boundary
Baseline adjunctive diagnosis,INDIRECT_ONLY,The current study preserves original diagnostic context but does not re-establish thresholds.,"Assay-specific threshold recovery, calibration and prospective consecutive recruitment",Do not describe as newly validated baseline diagnostic performance.
Repeat testing at 24 h,SUPPORTED_FOR_SCORE_CHANGE_DESCRIPTION,Within-patient score stability or drift can be quantified at T24.,Interpretation bands and prospective clinical anchors,Sampling time must be stated with every score.
Repeat testing at 48 h,SUPPORTED_WITH_ATTRITION_CAUTION,Within-patient drift and cohort heterogeneity can be quantified at T48.,Prospective handling of informative dropout and interpretation bands,T48 evidence is more vulnerable to dropout and recovery-state selection.
Treatment-response monitoring,LIMITED_BIOLOGICAL_ANCHOR_ONLY,Some score changes may track prespecified pathway changes.,"Replicated synchronous clinical anchor, assay repeatability and prespecified response criterion",Do not use pathway coupling as proof of treatment responsiveness.
Prognostic assessment,EXPLORATORY_CONTEXT_ONLY,Fixed outcome labels can describe cohort composition.,"Prospective prediction model, calibration and independent validation",No mortality association is interpreted as prognostic validation.
Clinical decision support,NOT_SUPPORTED,No treatment or triage recommendation.,"Impact study, explicit action threshold, benefit-harm analysis and external validation",Current evidence cannot guide treatment.
